abstractText,agency,awardeeName,awardeeStateCode,fundsObligatedAmt,id,piFirstName,piLastName,publicAccessMandate,date,title
"Human populations have migrated to nearly every environment in the world, and as part of this process have modified and integrated with local ecologies. Human alterations to the environment, such as deforestation, contribute significantly to zoonotic disease transmission, including transmission of pathogens (bacteria, viruses, and other microorganisms) from animals to humans, and from humans to animals. Less well studied are the impacts of the human-altered environment on marine mammal populations. This doctoral dissertation research project investigates the transmission of a human pathogen into marine mammal populations, uses preserved microorganisms on historical marine mammal remains as a unique resource to measure human-animal pathogen transmission, and explores the impact of human alterations on the marine environment. This project and the dissemination of its results serve to build collaborative research among anthropologists, conservation biologists and environmental ecologists through publication and through outreach with the National Parks Service, Skype a Scientist, and STEM mentorship for the Oklahoma Louis Stokes Alliance for Minority Participation. 

Coastal runoff increases the introduction of human pathogens and antibiotics into the environment. This can lead to the spread of zoonotic disease in wildlife and the environmental selection for antibiotic resistance. Of importance, Klebsiella pneumoniae, a common hospital acquired infection of humans, has become endemic among California sea lions along the California Channel Islands. In addition, a hypervirulent strain of Klebsiella pneumoniae (hvKp), has been documented along the Pacific Rim. However, the origin of this transmission event is unknown. This project studies the introduction of Klebsiella pneumoniae into the California sea lion population using museum collections. Museum collections can provide a timeline for studying environmental alterations as well as pathogen emergence. The investigators use metagenomic sequencing on California sea lion dental calculus to reconstruct the microbial community and link changes in microbial diversity to human activity. The investigators also perform in-solution DNA capture on specimens with Klebsiella pneumoniae to determine which strains are present. By investigating the oral microbiomes of California sea lions across time, the investigators assess whether any human-mediated alteration to the microbiome allowed for easier transmission of Klebsiella pneumoniae into the sea lion population.

This award reflects NSF's statutory mission and has been deemed worthy of support through evaluation using the Foundation's intellectual merit and broader impacts review criteria.",NSF,University of Oklahoma Norman Campus,OK,31000,2142133,Courtney,Hofman,1,02/09/2022,Doctoral Dissertation Research - Humans as reservoirs: Historical microbiomes uncover hidden zoonotic pathways
"Biological collections are a primary source of information to understand Earth’s biodiversity. They not only document existing diversity, but also provide the baseline to track changes across time and geography, as well as extinctions at local and global scales. This project aims to rescue the orphaned Fish Collection of the Department of Marine Sciences at the University of Puerto Rico, Mayaguez (UPR-M), improve access to specimens and associated information, and expand the shelving capacity of the Ichthyology Collection at the Sam Noble Museum (SNOMNH). Integration and accessibility of the two fish collections have the potential to be used across multiple scientific disciplines, including ecology, conservation biology, taxonomy, phylogenetics, fisheries management, anatomy, and physiology. The proposed activities for this proposal are organized around three primary goals—rescue, integration, and long-term preservation—each associated with specific timelines to achieve the overarching proposal goals. The team combines expertise of graduate and undergraduate students, and volunteers with museum experience at different levels in Oklahoma and Puerto Rico to provide a rich context for workshops, and for the development of an integrative training program for the next generation of scientists.
	Natural history collections play a fundamental role as repositories of biodiversity and provide verifiable and permanent records of wildlife and past environmental conditions. This project will rescue and safeguard the UPR-M Ichthyology Collection, one the largest biorepositories of marine fish biodiversity in the Caribbean, encompassing historical data from 13,000 specimens, comprising 805 species, 392 genera, and 123 families in imminent danger to become lost. Integration of the UPR-M Ichthyology collection into the SNOMNH will greatly increase its accessibility to scientists and other users through improved physical access, specimen loans, digitization of the collection, and sharing of data via the museum website, and other network portals. This project will enhance the infrastructure of the SNOMNH Ichthyology Collection and increase its scientific value and accessibility for scientists, educators, and the general public. The SNOMNH Ichthyology Collection is an important scientific resource and biological legacy for the lower Great Plains representing about 20% of the total fish diversity of the United States. It hosts diverse assemblages of mostly freshwater fishes (although its scope has recently expanded to include marine fish species as well), and endemic regional fish fauna from streams and reservoirs in Oklahoma. This project will provide multiple opportunities for integrating research into learning and education activities. Students at UPR-M and OU will participate in the collections-based activities as part of their academic and practical experiences and summer workshops at Puerto Rico.

This award reflects NSF's statutory mission and has been deemed worthy of support through evaluation using the Foundation's intellectual merit and broader impacts review criteria.",NSF,University of Oklahoma Norman Campus,OK,602344,2131464,Dahiana,Arcila,1,01/21/2022,CSBR: Emergency Rescue of the Orphaned Fish Collection of the University of Puerto Rico and Capacity Expansion of the Ichthyology Collection at the Sam Noble Museum
"The goal of this project is to develop computer software that allows scientists to compare the genomes of natural populations of organisms. Population genomics (the study of diversity in the genomic DNA of populations instead of individuals) has important applications in agriculture, anthropology, conservation, medicine, and several other fields of biology. Recent technology advances have greatly lowered the cost of DNA sequencing so large amounts of data are available. At the same time statisticians have developed new methods for analyzing large collections of genome-sized data. Combining the data with the new analysis approaches can let scientists answer fundamental questions about the biology of species that have never before been accessible. However, most population genomics studies fail to take advantage of the latest population genomics statistical methods. This is because the genomic data requires a lot of processing to prepare it for the analysis steps, and these operations are not easy to learn. Lack of bioinformatics knowledge has led to erroneous conclusions, irreproducible results, incomplete analyses, and slow turnaround time of population genomics projects. This project aims to provide software that can handle those tasks in a consistent and correct way and allow direct access to the statistical tools, to bring about new insights in population biology. 

This project will address the largest impediments to model-based population genomics by building a user-friendly and intuitive pipeline platform, the ""Pop-gen Pipeline Platform"" (PPP). This platform will help researchers avoid the problems inherent in re-inventing data processing scripts to feed data into their population genomics analyses, and considerably reduce time and effort. PPP will include tested scripts and pipelines for data preparation, and in addition the tools needed to build evolutionary models, carry out analyses of data, and create visualization of results via the Ruffus Computation Pipeline Library in Python. PPP will also be developed as a stand-alone application with a graphical user interface (GUI) under the popular and robust Galaxy Project (www.galaxyproject.org) for bioinformatics analyses. An online server deploying Galaxy/PPP will be developed and maintained at Temple University, Philadelphia (www.dev3.cst.temple.edu) for users to interactively submit jobs on a first-come-first-served basis. Online forums will be established for support, and to collect suggestions regarding what is desired for further development under PPP. Tutorials and videos about example applications of the PPP will be added to the Galaxy Project Wikipedia training channels. Additionally, a significant part of this work will involve educating Temple University seniors, Philadelphia area high school teachers, and their students about the power of bioinformatics in modern biology through summer workshops. Information about PPP, and associated developments can be accessed at https://bio.cst.temple.edu/~hey/software/software.htm.",NSF,San Diego State University Foundation,CA,13444,2203184,Arun,Sethuraman,0,12/09/2021,ABI Development: Improved Tools for Population Genomics
"The Arabidopsis Biological Resource Center (ABRC) at The Ohio State University stores, amplifies and distributes seeds, plasmid clones and other resources of Arabidopsis thaliana, a key model system for plant research. These have included DNA libraries, cDNA collections, various mutant seed populations and germ plasm from across the globe that represent the immense natural genetic variation of the species. For 30 years, the ABRC has had a global role in facilitating essential and fundamental plant research. ABRC resources have promoted discovery in photosynthesis and all aspects of plant development that have been instrumental in promoting agricultural improvement, green technology, and basic medical research. This award will support the ABRC's core mission to inexpensively distribute DNA and seed resources to the plant biology community, and to support plant science education by providing seeds and teaching resources free-of-charge to K-12 teachers. This project continues the mission of the ABRC to enlarge and expand the collection though acquisition of new resources while at the same time increasing the efficiency of the operation. Substantial outreach and education efforts will allow the ABRC to be a leader in local, national and international outreach and education, providing opportunities to inspire and train future generations of plant scientists.

This project will maintain and increase the current high levels of resource distribution, particularly for seed stocks. The ABRC will maintain quality control testing with an emphasis on stocks that are ordered frequently, stocks in long term storage, and those known to require special storage conditions. The Center will expand the collection through the collaborative inclusion of additional Brassicaceae species, especially Thlaspi arvense (pennycress), a species that has potential oil crop and biodiesel applications. Outreach activities, both local and national, will include the development and solicitation of new education resources and that expands the reach of our successful outreach programming.

This award reflects NSF's statutory mission and has been deemed worthy of support through evaluation using the Foundation's intellectual merit and broader impacts review criteria.",NSF,Ohio State University,OH,197045,2122274,David,Somers,1,12/06/2021,Infrastructure Capacity for Biological Research: Biological Collections: Growth and Development of the Arabidopsis Biological Resource Center
"Physical characteristics of animals can help determine which ones survive and flourish, especially in a changing environment. These characteristics, also known as functional traits, include features such as length, height, shape, weight, growth rate, sex, and reproductive state. Studying these traits provides insights into how communities of different types of animals come together and how species and communities respond to changes in their environment over time, which is critical for conservation efforts. However, very little information about functional traits is available, and what is available is difficult to combine with other data. How these traits are influenced by environmental changes - such as climate change, pollution, urbanization and human predation - and how they shift over longer timescales are poorly understood, and the need for this information is outstripping the speed with which scientists can collect these data. Digitized collections of animals representing life from the past two million years contain a treasure trove of information about these individuals' functional traits, but these data are stored in multiple places and in different formats. Researchers may have recorded dates differently, for example, or used a variety of terms to describe a single physical feature. Making these data widely available in standardized formats could help scientists study changes in functional traits through time, linking their observations of traits of modern animals to those from fossil and archaeological records. The Functional Trait Resource for Environmental Studies (FuTRES) project will gather trait data from digitized records; to engage communities of researchers to make these data available, standardized, and useable; and to develop a more complete workflow for using these data in research. 

Functional trait data have revolutionized ecology and are transforming paleontology, but acquiring them requires extensive labor, not only in measuring traits but in managing and communicating the resulting data. When trait data are lacking, researchers substitute average values, or other characteristics like behavioral or dietary categories. These substitutes - assigned at the species level - obscure intraspecific changes in traits. FuTRES fills the clear need for informatics tools that give researchers access to existing trait data and a place to store new data as they are generated. FuTRES is assembling a varied collection of existing trait data, building a pipeline that converts data to an integrated, semantically enriched form, and developing an Application Programming Interface (API) and web platform to serve the data. One of the key innovations of FuTRES is the use of ontologies, an information science approach that creates computer-readable definitions of traits and describes the interrelationships of traits, organisms, collecting events, and other entities. In this way, FuTRES will make functional trait data searchable through reference to time, space, and vertebrate anatomy.  FuTRES will also provide access to trait data via popular data portals (e.g., VertNet) and software such as R, opening the data to scientists in biodiversity and other domains. The toolkit will be tested with mammalian use cases that leverage the massive scale of the unlocked data.  In sum, newly created access mechanisms and tools will provide novel approaches for analyses of trait variation across space and time, providing researchers in disparate fields discovery capabilities for relevant data that would otherwise have been invisible to them.

This award reflects NSF's statutory mission and has been deemed worthy of support through evaluation using the Foundation's intellectual merit and broader impacts review criteria.",NSF,Battelle Memorial Institute,OH,65744,2201182,Meghan,Balk,1,11/18/2021,"Collaborative Research:  ABI Innovation: FuTRES, an Ontology-Based Functional Trait Resource for Paleo- and Neo-biologists"
"This award is funded in whole or in part under the American Rescue Plan Act of 2021 (Public Law 117-2).

Adversity in early life has wide-ranging effects on individual growth and development. Research has documented important deficits in growth, especially in the limbs. Yet, changes induced by early life adversity are almost certainly expressed in other aspects of skeletal morphology. This doctoral dissertation research project uses life history theory to investigate how energetic trade-offs impact bone growth as well as bone structure and dynamic remodeling to develop a more complete understanding of the effects of early life condition on growth and development outcomes. These insights also shed light on more general drivers of individual variation and the evolutionary and biological mechanisms that enable such variation. The project supports the training and mentorship of diverse undergraduate and graduate students. Results will be shared via publications, outreach, and educational efforts to ensure broad dissemination. 

The research project investigates these issues in primates with well documented variation in growth and development outcomes and in socio-ecological environments during development. The investigators test the hypothesis that individuals born into high quality early life conditions (moderate rainfall, mothers of high dominance rank) will have improved markers of growth and structural and material properties of bone. The investigators test the additional hypothesis that the magnitude of impacts will be stronger in comparison to individuals with multiple sources of early life adversity. The investigators test the hypotheses via analysis of long bone lengths, cross-sectional geometric properties of bone, bone porosity, and parameters of bone remodeling. The study is novel in its integration of standard whole bone measurements with investigations of bone’s internal microscopic structural properties. Findings leverage bone’s ability to act as a window into an individual’s developmental past, providing insight into how the skeleton responds to environments throughout life and more general insights into the primate evolutionary biology.

This award reflects NSF's statutory mission and has been deemed worthy of support through evaluation using the Foundation's intellectual merit and broader impacts review criteria.",NSF,George Washington University,DC,16748,2120962,Shannon,McFarlin,1,08/18/2021,Doctoral Dissertation Research: Impacts of early life adversity on bone growth and maintenance
"This award is funded in whole or in part under the American Rescue Plan Act of 2021 (Public Law 117-2).

Learning what to eat, how, and where to find food are significant challenges that arise over the course of development. Such challenges can also be social, when individuals have to compete with others for access to food. Yet how feeding competition affects food choice and developmental outcomes is poorly understood, particularly in scenarios where food is abundant and distributed evenly across an environment. This doctoral dissertation research tests how variation in feeding ecologies, including food competition, affects food choice and developmental outcomes among wild juvenile non-human primates inhabiting changing ecological and demographic environments. Results contribute to existing conservation management plans and provide concrete training opportunities to graduate and undergraduate students. Results will be disseminated widely to academic and non-academic audiences.

The proposal merges theory from nutritional ecology and life history to investigate the significance of feeding competition among developing non-human primates, who lack the foraging competence of adults. Major objectives include investigating: 1) variation in food nutritional properties along ecological gradients; 2) development of adult-like foraging competence; and 3) impacts of feeding competition on dietary development of infant and juvenile individuals. The researchers integrate novel and long-term data on food nutritional properties and feeding behavior sampled across a diversity of habitat types. They collect novel nutritional data from plant food samples as well as feeding data generated through long-term monitoring and new behavioral observations. Results inform understanding of the evolution of primate juvenile periods, by improving our understanding of how immatures are impacted by feeding competition, even in contexts where food is apparently abundant. Further, this research generates insights regarding developmental responses to changes in ecology, which are important for predicting population dynamics and associated implications for conservation efforts.

This award reflects NSF's statutory mission and has been deemed worthy of support through evaluation using the Foundation's intellectual merit and broader impacts review criteria.",NSF,George Washington University,DC,15750,2120910,Shannon,McFarlin,1,08/18/2021,Doctoral Dissertation Research: The effects of nutritional ecology and feeding competition on growth and development
"Access to clean water is a fundamental requirement for a healthy society. Numerous water safety crises in the past decade have shown that access to safe drinking water is not a guarantee, however. Moreover, there is community- and individual-level heterogeneity in relative vulnerability to water problems. Individual characteristics are likely to affect perceptions of water, in turn affecting decisions surrounding water use and associated health outcomes. This project brings together an interdisciplinary team of scientists to examine social, behavioral, health, and climatic issues related to water resources. In addition to developing capacity at a minority-serving institution, the project  advances undergraduate teaching and training through curricular development and hands-on research opportunities. 

The project tests social science theories positing that ecological and social factors work together to affect water and climate vulnerability. Research objectives include examining the influence of social, economic, and political factors in water quality remediation efforts in a context with contemporary and historical variation in deployment of such efforts; and providing an analytical framework transferable to other environmental remediation projects. To do so, this project documents perceptions of water among diverse stakeholders, and how these perceptions interact with individual and community characteristics. The project also analyzes and provides data to document the full range of climate variability to layer results within broader historical climatic fluctuations. Importantly, this climate history will provide context for the lived experiences of people in the region over space and time and allow improved modeling to anticipate future changes in precipitation and water access.

This award reflects NSF's statutory mission and has been deemed worthy of support through evaluation using the Foundation's intellectual merit and broader impacts review criteria.",NSF,William Paterson University,NJ,292640,2127335,Nicole,Davi,1,08/16/2021,"Collaborative Research: Socio-economic patterns, public perceptions, and climate vulnerabilities of water resources and quality"
"This award is funded in whole or in part under the American Rescue Plan Act of 2021 (Public Law 117-2). 

The human gut microbiome is a community of bacteria and other microorganisms that has co-evolved with humans and plays important roles in metabolism and health. Rapid global industrialization has led to changes in diet, lifestyle and medical practices, all of which may shape the early life development of the gut microbiome and its contribution to energy storage and fat deposition. This doctoral dissertation research project examines how infant feeding and care shape the development and energetic function of the gut microbiome and infant growth and fat deposition. The findings can inform the understanding of how evolutionarily novel environments interact with biology and culture and influence the development of the human microbiome and its contribution to growth in early life. The project provides training and mentoring in STEM for female scientists and involves science and public health outreach in local communities.

This project integrates approaches from biocultural anthropology and evolutionary medicine to understand how early environments shape infant growth and metabolism through the gut microbiome. The primary aim of the project is to examine the impact of different complementary diets (an infant’s first non-milk foods) and antibiotic exposure on infant growth and the composition and energetic function of the gut microbiome during the weaning period. With a longitudinal cohort of mother-infant dyads in urban and rural settings, the investigators use next-generation sequencing and targeted metabolomics approaches to measure the composition of bacterial communities and short-chain fatty acids (markers of microbial energetic activity) in infant fecal samples. The investigators also collect qualitative and quantitative data on infant diet, health histories, antibiotic exposures, adiposity and growth rates from 4 to 8 months postpartum.

This award reflects NSF's statutory mission and has been deemed worthy of support through evaluation using the Foundation's intellectual merit and broader impacts review criteria.",NSF,Yale University,CT,25175,2117557,Claudia,Valeggia,1,08/15/2021,Doctoral Dissertation Research: Industrialized ecologies and infant gut microbiome development
