abstractText,agency,awardeeName,awardeeStateCode,fundsObligatedAmt,id,piFirstName,piLastName,publicAccessMandate,date,title
"State hospitals in the United States have generated considerable discussion among practitioners, government officials, and the general public, from the rise of the asylum in the 19th-century through deinstitutionalization efforts originating in the 1950s. This doctoral dissertation project will examine the biological impact of institutionalization through skeletal analysis of persons who were institutionalized in the past. The research will advance our understanding of institutionalization beyond what can be gleaned from historical accounts alone, and offers a framework for future biological anthropology research to incorporate interdisciplinary approaches. The research may raise mental health awareness and presents an innovative method of linking health disparities in past institutionalized samples to modern-day psychiatric treatment. The project will support graduate training as well as public and descendant community science engagement.

This dissertation research uses skeletal samples from asylums in four states (Colorado, Mississippi, Missouri, and Ohio) to understand how incarceration impacts institutionalized women’s health and how it is differentially embodied across ancestry and geographical region. In bioarchaeology, evidence can be seen through varying skeletal pathologies that reflect health disparities indicative of negative conditions that people endured during life. The analysis will focus on skeletal trauma, disease, and fracture analysis which will be statistically examined through hierarchical log-linear analysis and binomial logistic regression. The project highlights the heterogeneous physiological impact of past mental institutionalization in their socio-cultural and historical contexts. It investigates whether skeletal health and epidemiological differences or trends exist across institutionalized geographical samples and attempts to determine if differences in trauma and disease patterns between African-American and Euro-American groups are present in order to gain insight into the impact of racism and segregation within the institutional setting.

This award reflects NSF's statutory mission and has been deemed worthy of support through evaluation using the Foundation's intellectual merit and broader impacts review criteria.",NSF,University of South Carolina at Columbia,SC,20546,1945777,Carlina,de la Cova,1,04/15/2020,"Doctoral Dissertation Research: Violence, Structural Inequality, and Institutionalization"
"Mycobacterium tuberculosis has a global distribution and infects over a million new people each year. In the pre-contact Americas, tuberculosis (TB) infection was caused by a strain that is found today in seals and sea lions. This doctoral dissertation project investigates how a zoonotic strain of TB adapted to humans as a primary host and spread across the Americas. Throughout the project, undergraduate students at Arizona State University will be trained in genomic lab work and analysis, and the resulting datasets will be used to create undergraduate-level workshops. The research team will demonstrate an equitable international collaboration by fostering mutual understanding and inclusivity among affiliated parties, thereby facilitating long-term, innovative, and productive relationships between institutions.

The Mycobacterium tuberculosis complex (MTBC) refers to a group of similar pathogens that cause TB infection in humans and animals. Genomes extracted from archaeological remains show that zoonotic lineages were responsible for human TB infections in the past. Most TB infections in humans today, however, are caused by M. tuberculosis, the human-adapted MTBC lineage. The evolutionary steps of an animal-adapted pathogen becoming a human-adapted pathogen are not entirely understood. The researchers will draw comparisons between modern and ancient MTBC genomes to understand better how zoonotic lineages of TB adapt to humans as primary hosts. Ancient MTBC genomes will be extracted from archaeological skeletons. The research team focuses on a densely populated city and trade epicenter to determine the breadth of genomic diversity of ancient circulating MTBC strains, some of which were likely imported through long-distance trade. As human populations expand and the interface between humans and wildlife narrows, understanding the genomic underpinnings of zoonotic transmission dynamics will inform public health surveillance measures. The results of these comparisons will help frame future epidemiological, evolutionary biology, and infectious disease research.

This award reflects NSF's statutory mission and has been deemed worthy of support through evaluation using the Foundation's intellectual merit and broader impacts review criteria.",NSF,Arizona State University,AZ,31398,1945812,Anne,Stone,1,04/06/2020,Doctoral Dissertation Research: The Zoonotic Origins of Tuberculosis Infection in the Pre-contact Americas
"Humans are distinguished by their ability to walk upright on two legs and their capacity for endurance running. This behavior is explained in part by the endurance capabilities of human skeletal muscle, which, in comparison to chimpanzees, are better suited for holding bodies upright and being active for prolonged periods without fatiguing. However, it is unknown how this property of human skeletal muscle evolved due to its absence from the fossil record and a limited understanding of muscle fiber development at the genetic level. This doctoral dissertation project will identify the genetic switches controlling muscle fiber development using a suite of cutting-edge molecular methods. In doing so, this research will add novel information about the complex genetic landscape underlying muscle fiber development and illuminate the evolutionary history of a unique human trait that may have played a key role in bipedal evolution. This project will support graduate training in advanced molecular methods and bioinformatics. Additionally, the researcher will share their findings with the public by hosting a “science run” outreach event. Finally, data generated from this research will help characterize muscle biology at the genetic level and therefore has the potential to help target more efficient treatments for a range of neuromuscular diseases.

Understanding when, why and how the transition to bipedalism occurred over the course of human evolution is a fundamental question in biological anthropology. As a species, humans are characterized by a suite of well-described anatomical adaptations that support efficient, long-distance bipedal locomotion. While many of these traits are observable in the fossil record (e.g., bone morphology), others (e.g., properties of skeletal muscle) are more difficult to detect. The high proportion of fatigue-resistant slow-twitch muscle fibers in human hind limb muscles optimizes them to perform tonic, endurance-based activities, and suggests that this trait helps enable long-distance bipedal locomotion. Yet, the genetic mechanisms controlling this trait are not well understood. To address this gap in knowledge, this project will identify the genetic mechanisms underlying muscle fiber development and reconstruct the evolutionary history of these mechanisms across primates. The central hypothesis of this research is that natural selection has selected for human-specific variation in regions of the genome that influence muscle fiber type, increasing the amount of slow-twitch fibers in human hind limb skeletal muscles and the efficiency of bipedal locomotion. To test this hypothesis, the researcher will first use a tailored ATACseq approach to identify those parts of the genome that are active in mammalian muscle tissues and associated with muscle fiber type. Next, they will test the function of a subset of these regions with human-specific variation. In doing so, this project will enrich anthropological understandings of human evolution by identifying regions of the human genome that have shaped the biology of a trait highly relevant to bipedalism.

This award reflects NSF's statutory mission and has been deemed worthy of support through evaluation using the Foundation's intellectual merit and broader impacts review criteria.",NSF,University of Oregon Eugene,OR,29395,1945809,Kirstin,Sterner,1,04/06/2020,Doctoral Dissertation Research: Uncovering the regulatory landscape of myofiber type in the context of human evolution
"In biocultural research, anthropologists are interested in the complex interactions between biology and culture that occur throughout the human lifecourse. One important part of the lifecourse is the time immediately following the birth of a child, when mothers experience physiological changes, may be vulnerable to various stressors, and potentially receive help from other individuals. This doctoral dissertation research examines the relationships between maternal postpartum depression, culturally relevant social support, and maternal levels of the hormone oxytocin, to better understand the postpartum period from a biocultural perspective. The project will advance fundamental knowledge about maternal dynamics and the biocultural nature of our species. The research may also have broader public health impact by informing culturally appropriate interventions for improving postpartum maternal health. In addition, the project will support graduate training, international research collaborations, and community science outreach. 

A cooperative breeding model has been used to describe patterns of infant care in humans. Mothers especially benefit from help during the immediate postpartum when the stress of caring for an altricial infant co-occurs with physical recovery from pregnancy. This project focuses on maternal characteristics in the immediate postpartum, thereby extending beyond previous work that focused largely on reproductive fitness and infant outcomes. Following a cohort of women who share cultural expectations regarding postpartum support, this study will examine whether greater discordance between received and expected social support in the postpartum is related to maternal depressive symptoms, and whether oxytocin and social support levels are related. The project will characterize local cultural expectations of social support via interviews with women. A group of 150 pregnant women will be interviewed during their third trimester, and again approximately 40 days postpartum to determine congruence between received support (reported and directly observed) and cultural expectations of social support, depressive symptoms, and urine oxytocin levels.

This award reflects NSF's statutory mission and has been deemed worthy of support through evaluation using the Foundation's intellectual merit and broader impacts review criteria.",NSF,Ohio State University,OH,25200,1942841,Barbara,Piperata,1,04/06/2020,Doctoral Dissertation Research: Biocultural dynamics of the postpartum interval
"Growth is a central aspect of a species’ biology, and modern humans are fundamentally different in the timing, duration, and pace of our growth compared to other primates. Understanding when and why the modern human growth pattern evolved is key to understanding part of what makes modern humans unique among primates. This doctoral dissertation project examines the links between variation in primate growth rates and hormonal underpinnings via the pituitary gland and a bony structure, the sella turcica. In doing so, it will develop a novel, non-destructive method for estimating individual growth rates and will investigate the effects of ecology and environment on living primates’ growth rates. The insights into pituitary and sella turcica growth and evolution provided by these data also have the potential to inform diagnoses of abnormal pituitary conditions and the etiology of growth deficiencies or diseases related to pituitary hormones. This project will support graduate training and undergraduate research experiences at Arizona State University (ASU), expanding educational opportunities and providing undergraduates with advanced visualization and 3D processing skills that can be applied to fields as varied as engineering and medicine. In addition, the researcher will communicate project findings through science education outreach activities for student and public audiences. 

Given the importance of growth, the ultimate causes (or selective pressures) that shape growth rates have long been the subject of research, but the proximate mechanisms that underpin variation in growth rates are less well studied. At the proximate level, body growth is the direct result of hormones produced by endocrine glands such as the pituitary. This project builds upon the relationship between the size of the pituitary, which is positively correlated with growth rate across mammalian taxa, and the sella turcica, the bony structure within which the pituitary gland is housed, to first test whether the size of the nonhuman primate sella turcica reflects body growth rate. This goal will be achieved by pairing 3D cranial morphology data with growth data from well-studied primate populations. Second, this research will assess how aspects of ecology and demography (i.e., ultimate causes such as resource availability, food quality, mortality) relate to living primates’ body growth rates both within the study populations and across a comparative sample of 51 species. It will then assess whether these ecological variables also explain variations in relative sella turcica size. Together, the complementary components of this project will contribute to a better understanding of primate growth.

This award reflects NSF's statutory mission and has been deemed worthy of support through evaluation using the Foundation's intellectual merit and broader impacts review criteria.",NSF,Arizona State University,AZ,22077,1945805,Gary,Schwartz,1,03/31/2020,Doctoral Dissertation Research: Hard tissue correlates of primate growth rate variation
"Fundamental research in human biology has provided insight into the complexity of breastfeeding as a unique form of maternal investment that is responsive to offspring cues, sensitive to environmental inputs, and capable of influencing short- and long-term offspring outcomes. While much of this research has focused on implications for infant physiology, comparatively little is known about the biological determinants and impacts of breastfeeding practices among mothers. This doctoral dissertation project will investigate the maternal physiological dynamics of breastfeeding, advancing knowledge about the ways in which immune function, physiological status, and behavior are interrelated in humans. The research may also inform public health research and practice about breastfeeding behaviors. The project will facilitate graduate and undergraduate training and mentoring, and research outcomes will be shared with the participant community as well as a broader research and public audience. 

Few studies have directly examined the link between maternal immune function, maternal physiological status, and breastfeeding behavior in humans during the perinatal period. This study will longitudinally measure breastfeeding behavior, immunological biomarkers, and perceived physical and mental well-being among a heterogenous sample of pregnant and postpartum women in the United States, a population exhibiting unprecedented variation in breastfeeding behavior. The resulting data will be used to test two overarching hypotheses: (1) heightened inflammatory activation in late pregnancy will predict increased breastfeeding difficulties and impaired maternal physiological status, and (2) continuation of skin-to-skin breastfeeding across the early postpartum period will correspond to better regulated immune “bounce-back” and enhanced maternal physiological status. Findings generated by this study have the potential to inform current public health strategies to (1) identify mothers who may experience heightened barriers to breastfeeding success, (2) provide support for women to continue breastfeeding, and (3) support mental and physical maternal well-being during the transition from pregnancy to the postpartum period.

This award reflects NSF's statutory mission and has been deemed worthy of support through evaluation using the Foundation's intellectual merit and broader impacts review criteria.",NSF,University of California-Santa Barbara,CA,30934,1945759,Amy,Boddy,1,03/26/2020,Doctoral Dissertation Research: Inflammation and mother-infant dynamics in an industrialized environment
"The classification of species based on skeletal morphology (shape) often has been focused on characteristics of the cranium (skull). However, research has also begun to address the taxonomic signal of other parts of the skeleton. This doctoral dissertation project will use state-of-the art 3D scanning technology to provide a systematic taxonomic assessment of the cranium and numerous post-cranial skeletal elements among closely related species of macaques. Macaques are an ideal model system because they are geographically widespread, there are numerous species, and they occupy a wide range of dietary and climatic niches. The results will provide novel insights into which aspects of skeletal morphology best reflect the genetic relationships of macaques, as well as which bones best reflect dietary, locomotor, and environmental differences among species. Findings in extant primates also will inform the study of fossil species where genetic information is typically not available. The research advances the career of a female scientist, and results will be disseminated to K-12 students from historically underrepresented groups. In addition, 3D models will be used to educate students about how animals with different morphologies adapt to their environments. Public outreach also will be achieved through blog posts, workshops, and seminar presentations.

This project seeks to determine if morphological data inferred from the skeleton tracks genetic distances, and therefore, can be a useful tool for species assessment. Skeletons of the relatively specious and geographically widespread macaque will be used to test the hypotheses that (1) taxonomy can be accurately predicted based on morphological patterns, and (2) post-cranial elements may reflect taxonomy at the same level, or better than, the skull. Data will consist of 3D morphometric analyses of eight macaque species and three non-macaque out-groups, each chosen for their diverse genetic, geographic and behavioral relatedness. In cases where bones do not follow the pattern expected by genetics, additional statistical analyses will be performed to test the extent to which skeletal morphology is driven by climatic, dietary or locomotor differences between species. The outcomes of this research will include a large dataset of 3D bone scans from a single primate genus, which will be publicly shared. Moreover, the results will provide an important bridge between the analysis of living primate species and extinct fossil species for which only fragmentary skeletal morphology is known.

This award reflects NSF's statutory mission and has been deemed worthy of support through evaluation using the Foundation's intellectual merit and broader impacts review criteria.",NSF,SUNY at Buffalo,NY,23158,1945735,Noreen,von Cramon-Taubadel,1,03/17/2020,Doctoral Dissertation Research: Investigating taxonomic efficacy of the skeleton in a primate genus
"The growth and development of the human skeleton is affected by the way it is used across the life course.  In order to understand how human skeletal development evolved, it is useful to study skeletal development in other closely related primates. The goal of this doctoral dissertation project is to investigate how changes in locomotion across the chimpanzee life course are reflected in the skeleton. Chimpanzees change from moving mostly in the trees when they are young to moving more on the ground as they age, providing an opportunity to examine how chimpanzee trabecular (spongy) and cortical (compact) bone are modified as locomotion changes across the life course. The research will contribute to our understanding of bone biology, specifically the sensitivity of the skeleton to changes in movement throughout life, which can be used to better reconstruct the locomotion of extinct fossil apes and humans, particularly the evolution of terrestriality. This research will be used in K-12 science outreach and exhibited at natural history museums. CT scans and 3D prints of Pan troglodytes and fossil hominoids (apes) will also be part of an international exhibit focused on ape evolution and conservation. All CT scans generated from this project will be shared with the museums where the data were collected, furthering scientific access and inquiry. 

Bones are a crucial source of data from the fossil record because they undergo modification in response to the mechanical loads placed upon them during movement (e.g. walking, running, climbing). However, most studies to date focus on either trabecular or cortical bone and not the two together in one study. Chimpanzees modify how they move through their life, shifting from more arboreal to more terrestrial substrates from infancy to adulthood. Thus, if the skeleton is responding to these changes, the investigators hypothesize that these transitions will be detectable in trabecular and cortical bone. This study will also address whether both bone types respond to locomotor changes during development, and will apply these findings to other species, extant and fossil, to help in recovering patterns of movement and substrate usage. These questions will be addressed using microCT scans of trabecular bone in the fore- and hindlimb as well as pQCT scans of cortical bone in the shaft of the femur, tibia, humerus, and radius. The prediction is that trabecular and cortical bone at each life history stage will reflect the locomotor behaviors used at that time. By further studying the relationship between ontogenetic changes in behavior and cortical and trabecular bone structure, novel anatomical proxies sensitive to loading patterns may be identified and used to reconstruct the locomotor repertoires of fossil apes and humans.

This award reflects NSF's statutory mission and has been deemed worthy of support through evaluation using the Foundation's intellectual merit and broader impacts review criteria.",NSF,Regents of the University of Michigan - Ann Arbor,MI,31200,1945692,Laura,MacLatchy,1,03/17/2020,Doctoral Dissertation Research: Trabecular and cortical skeletal correlates to locomotor ontogeny in hominoids
"This doctoral dissertation project will examine the quantity and path of nerves that run through the jaws and teeth of mammals to establish if the size of these nerves is related to diet. The investigator will focus on humans and non-human primates, to determine if different diets correspond to the concentration of soft tissues (like nerves, arteries, and veins) in specific sections of the mouth and teeth. The research will advance knowledge about the relationships between soft tissues, bony tissues, jaw function, and diet, and may also inform our understanding of craniomandibular plasticity in modern humans. The project will support undergraduate and graduate STEM training, create an open, online database of scan data, and be used in a variety of science outreach projects and blog posts aimed at K-12 and general public audiences. 

Primates use sensory mechanisms to choose foods based on color, taste, size, and texture. These sensory mechanisms are controlled by nerves in the skin, eyes, mouth, teeth, and other structures that allow a primate to determine if a food is safe for eating. The primary nerves that supply sensation to the mouth are branches of the trigeminal nerve that pass through the maxilla and mandible. Previous research indicates that larger nerves relay more sensory information at faster speeds, suggesting that it is important to know the size of nerves to understand their functions. It has also been established that primate diets are intimately tied to tooth shape and chewing function, suggesting that the properties of teeth and their accompanying nerves are selected for simultaneously in relation to how they sense the properties (i.e., toughness, stiffness) of foods. The proposed work will use microCT scanning and iodine staining methods to examine the relationship between tooth shape and the nerves of teeth, with a focus on how these structures vary in relation to primate diets. Teeth of primates that are adapted to leaf- or insect-eating are predicted to need more nerves in the back of the mouth (under the molars), while fruit-eating primates are expected to have more nerves at the front of the mouth. This hypothesis is supported by data showing that individuals eating tougher diets manipulate food objects within their mouth more than individuals that consume softer food objects. This manipulation is partly due to how primates use nerves to assess material properties of an object to ensure that the individual does not damage their teeth during chewing.

This award reflects NSF's statutory mission and has been deemed worthy of support through evaluation using the Foundation's intellectual merit and broader impacts review criteria.",NSF,University of Arkansas,AR,29800,1944642,Claire,Terhune,1,03/16/2020,Doctoral Dissertation Research: Neurovascular structures of the trigeminal nerve and their relationship to diet in primates
