abstractText,agency,awardeeName,awardeeStateCode,fundsObligatedAmt,id,piFirstName,piLastName,publicAccessMandate,date,title
"The Culture Collection of Algae at the University of Texas at Austin (UTEX) is one of only a handful of curated, public, biodiversity collections of living algae. UTEX is a repository and distribution center for algal biodiversity. The UTEX Collection is of the most genetically diverse assemblages of organisms available to the public and many of the algae UTEX maintains are unique and irreplaceable. Every year UTEX distributes thousands of living algal cultures, at modest cost, to scientists, educators, and students throughout the U.S. and the world. The great interest in microscopic algae as sources of transportation fuel, human food, animal feed, pharmaceuticals, and many other uses makes UTEX algae and services essential resources for hundreds of research projects. UTEX provides hands-on workshops on managing algal cultures, an informative interactive web site, species identification services, chemical composition analysis, and extensive correspondence with students engaged in algal research. UTEX personnel give presentations at public schools, conduct tours of UTEX facilities, assist teachers and students in conducting high school science projects, and provide presentations on the scientific importance of algae to hundreds of children every year at local open house events.

UTEX currently maintains more than 3,000 unique living algal strains representing all major taxa, including over 450 type species. The UTEX mission is to promote, support, and enable the use of algae for research, education, and practical applications. In order to fulfill its mission, UTEX provides living algae to a user community at modest cost; serves as a permanent public repository of newly discovered and recently described algal species of potential value representing a broad range of genetic, morphological and biochemical diversity; acts as a source of information regarding algae to practicing scientists, other professionals, and the interested public; promotes and supports local science teaching and hands-on scientific activities by school children; and provides practical training services, support services, and supplies that facilitate culturing of algae at other sites. UTEX provides living algae starter cultures, bulk cultures, growth media, photobioreactors, photometers, genomic DNA and digital images.  Services include identification of algae by morphological and DNA-sequence methods, physiological and biochemical characterization of algae, and cryogenetic storage of proprietary strains. UTEX maintains active research on cryopreservation technology, biochemical characterization, genomic sequencing, and taxonomic identification of accessioned strains. Algae-based research within the local institution is actively supported through the provision of cultures and by consultation with UTEX staff. Every year hundreds of published research articles reference the use of UTEX strains, many of which also recognize NSF support. In addition, many UTEX strains are used in research leading to the development of microalgae-based technologies for the production of biofuels and many other products. A comprehensive web site (www.utex.org) facilitates a secure means for ordering goods and services, provides links to resources elsewhere pertaining to algae, and includes diverse algae-related information.

This award reflects NSF's statutory mission and has been deemed worthy of support through evaluation using the Foundation's intellectual merit and broader impacts review criteria.",NSF,University of Texas at Austin,TX,803253,2015674,David,Nobles,1,03/18/2021,"CSBR: Living Stocks, Operation of a Culture Collection of Algae"
"Natural history collections document life on earth, past and present, and represent an invaluable and irreplaceable resource for the study of biodiversity. Proper and long-term management of natural history collections, including both physical specimens and their associated data, is crucial for scientific research by contemporary and future researchers. The Collection of Fishes at Texas A&M University is a substantial university-based ichthyology collection that has experienced rapid growth over the last 20 years. This collection serves a dual research and teaching role on the Texas A&M campus and more regionally, acting as both reference collection and specimen repository for researchers at other universities in Texas and other southern US states. A major goal of this project is a collection-wide physical re-organization and re-curation of specimens, coupled with a database platform migration that will safeguard the physical and digital content of this collection, facilitate growth, and broadly improve capacity to serve the national and international ichthyological research community as well as a growing community of non-traditional users of specimen data (e.g., K-12 educators, artists). Goals also include training of undergraduate students and Texas Master Naturalist volunteers in natural history specimen curation and management, novel undergraduate student course assignments and K-12 science-based art workshops focused on vertebrate natural history and ichthyology, and development of a temporary public exhibit showcasing the rare specimens from this university-based collection.    

The project will involve installation of new shelving and metal tanks to facilitate wholesale reorganization and re-curation of current alcohol specimens in the Collection of Fishes at Texas A&M University and to generate ample space for future growth.  A globally unique collection of oversized (10–14ft) shark specimens will be secured through container updates, specifically the replacement of a 40 year old custom-made oak casket with an industry standard air-tight metal unit.  Finally, data management platform upgrades will improve basic digital data management and enhance real time availability of specimen records via online international archives, including through iDigBio.org and VertNet.org.  Completion of these tasks will rejuvenate infrastructure available for fundamental ichthyological education, unique research, and discovery at Texas A&M University and globally.

This award reflects NSF's statutory mission and has been deemed worthy of support through evaluation using the Foundation's intellectual merit and broader impacts review criteria.",NSF,Texas A&M AgriLife Research,TX,205135,2035082,Kevin,Conway,1,03/18/2021,"Biological Collections: Crucial upgrades to specimen storage, organization, and database management at the rapidly growing Texas A&M Collection of Fishes"
"The skin microbiome — the collection of microorganisms that live on the surface of the human body — plays a critical role in regulating the immune system, yet little is known about how infants first acquire skin microbes in early life. Since microbes are transmitted between people, and human infancy is highly social, interactions with caregivers may be a critical component of infant skin microbiome development. This doctoral dissertation project examines how infant social networks and specific interactions between infants and their caregivers influence the diversity of microbes living on infants’ skin. Results of this project shed light on the understudied relationship between social behaviors and the infant skin microbiome, as well as laying the foundation for future studies that connect early life microbial exposures to particular physiological outcomes. Study participants, including mothers and other caregivers, will receive personalized reports based on research results, including information about their social networks as well as the structure of their skin microbiome and how it compares to that of their infant. This project also contributes to enhancing diversity and inclusion by training undergraduate students from groups underrepresented in STEM research in skin microbiome laboratory methods and statistical analyses. The project also has public health translational potential with respect to infant wellbeing.

Unlike other great apes, human mothers rely on additional caregivers, such as grandparents and older siblings, for long-term assistance with infant care. Common infant care practices, including holding and carrying, promote direct skin-to-skin contact between caregivers and infants, suggesting opportunities for skin microbes to be shared with infants. This project will investigate how social caregiving influences the infant skin microbiome, with an emphasis on the microbial similarity between the skin of infants and their caregivers. Researchers will collect skin swab samples from infants, mothers, and additional caregivers, and use microbial gene sequencing to characterize and compare the skin microbes present in the samples. Caregivers will complete questionnaires that ask about the frequency of specific practices that put them in physical contact with infants. The researchers will use these data to generate social networks that describe social relationships between infants and their caregivers, suggesting potential routes through which skin microbes are shared with infants. This project offers a novel perspective on the benefits of social caregiving to infants, and the results will highlight the role that the social environment plays in linking early life microbial exposures to health outcomes.

This award reflects NSF's statutory mission and has been deemed worthy of support through evaluation using the Foundation's intellectual merit and broader impacts review criteria.",NSF,Northwestern University,IL,25192,2041600,Katherine,Amato,1,03/17/2021,Doctoral Dissertation Research: The influence of the social environment on the infant skin microbiome
"Natural history collections record the world’s diversity through time and support the scientific community’s understanding of changing ecosystem dynamics. In the face of declining insect biodiversity worldwide, it is more important now than ever for entomology collections to preserve, digitize, and disseminate specimen data to the broader community. The Frost Entomological Museum at Penn State cares for more than 1.3 million specimens that span the diversity of insects. This collection stands to grow further, through the incorporation of satellite collections of pollinators, especially bees (more than 125,000 specimens), and through the activities of the Insect Biodiversity Center (IBC), a recently established research initiative at Penn State. The infrastructure provided through this grant increases the storage capacity of the Frost by 50%, allowing for the curation of these collections and to serve as a repository for scaled up efforts to understand insect diversity through time. The award also provides the resources to digitize the substantial aphid collection (approximately 224,000 specimens on 49,000 slides), which holds important data regarding these insects’ plant hosts, and aquatic insects (approximately 100,000 specimens in 15,000 vials), which are indicators of habitat health. These improvements will facilitate research that addresses native pollinator decline, epidemiology, global climate change and its impact on species distributions and invasive species, niche restrictions, indicator species, and the evolutionary history of insects. The project will also generate data that contribute to ongoing research on imperiled insects and will fill critical taxonomic, geographical, and temporal gaps in existing datasets.

A high-density compactor storage system will be installed in the Frost Museum in order to accommodate new rows of cabinets for pinned insects. These cabinets will accommodate approximately 1,600 drawers of expanded space. A portion of this storage will be utilized by incorporating the pollinator collection previously housed at Penn State’s Fruit Research and Extension Center and specimens generated by Penn State’s Center for Pollinator Research. The aphid collection, which consists of slide-mounted specimens, will be imaged on a flatbed scanner and then moved to new custom-built slide cabinets. The slide scans will be transcribed in the Frost Museum database, georeferenced, and the data shared with iDigBio and the Global Biodiversity Information Facility (GBIF). The aquatic insect collection likewise will be imaged and rehoused in new, expanded ethanol storage. The lot images will be transcribed, georeferenced, and the data shared with the above repositories, making them accessible to the public. A graduate student and at least two undergraduates will receive training in collections care, management, and digitization.

This award reflects NSF's statutory mission and has been deemed worthy of support through evaluation using the Foundation's intellectual merit and broader impacts review criteria.",NSF,Pennsylvania State Univ University Park,PA,391298,2039242,Andrew,Deans,1,03/16/2021,CSBR: Increased capacity for research and student engagement at the  Frost Entomological Museum
"The Duke Lemur Center is responsible for two unique and irreplaceable collections: the largest living population of lemurs outside of their native Madagascar and a natural history collection that includes one of the most diverse primate fossil collections in the United States. The fossil collection – with specimens from the United States, Egypt, Madagascar, and Colombia – helps researchers use the tree of life to connect lemur research to other primates, including humans. Unfortunately, some of the most important fossils at the DLC, including some of the oldest lemur fossils and some of the oldest monkey fossils, are actively breaking down because unstable salt minerals were embedded in the specimens during fossilization. This project is a rescue mission to stabilize and preserve these fossils in physical and digital form. Highly trained fossil technicians will remove salt minerals from the most endangered specimens and store the revitalized fossils in new specimen cabinets that better control the temperature and humidity around the specimens. The team will also create 3D scans of the specimens using x-rays. The scans create a back-up record of the fossils in case they continue to deteriorate. The scans will be uploaded to MorphoSource, an online repository that allows educators, students, and researchers to examine fossils in 3D from any device with internet access. With a better-stabilized collection, the DLC fossil collection can open to the public for in-person and virtual tours, and online exhibits and curriculum guides will be created by the DLC education team using scans and 3D prints.
 
The most unstable fossils in the collection come from Locality 41 in the Fayum Depression in Egypt. The site is one of the most fossil-dense terrestrial Paleogene localities in Africa. Along with primates like Catopithecus and Plesiopithecus, the site preserves giant hyraxes, rodents, bats, snakes, birds, and carnivores. The tennis-court sized fossil deposit in the Western Desert of Egypt was actively quarried in the 1980s through 2010s. The most fossil-rich sections were targeted by the excavation teams. This makes the collection at the DLC irreplaceable through additional fieldwork. This project partially supports a Fossil Preparator who will focus on the Egyptian collection as well as other unstable materials in the collection. It also partially supports a Digital Tomographer who will use the Duke microCT scanner to generate scans of the most at-risk specimens, and the DLC Data Manager who will work with the Tomographer to backup and upload scan data to MorphoSource. The data manager will lead the effort to add higher resolution specimen data to the DLC Specify database, which will integrate with iDigBio (idigbio.org) and the Global Biodiversity Information Facility (gbif.org). The project also supports microCT scanner access and new specimen storage cabinets. The DLC education team will use these newly stable specimens to create curriculum-targeted tours and guides for North Carolina K-12 students and visitors to the DLC. Ultimately, exceedingly fragile fossil specimens will be available in-person and online to researchers, students, and the general public.

This award reflects NSF's statutory mission and has been deemed worthy of support through evaluation using the Foundation's intellectual merit and broader impacts review criteria.",NSF,Duke University,NC,442704,2023087,Matthew,Borths,1,03/16/2021,CSBR: Rescuing and Sharing a Unique and Irreplaceable Fossil Collection at the Duke Lemur Center
"Nonhuman primates employ different strategies to locate resources such as food and water that support survival and reproduction. This doctoral dissertation research project examines how wild Kinda baboons’ movement strategies vary according to the distribution of resources in complex environments, and how their dietary choices affect the distribution of bacteria in their guts. Results from the study will provide important insights linking evolutionary strategies to search for foodstuffs to physiological outcomes in a social primate. While conducting the work, the doctoral student will participate in educational science programs for under-served K-12 students and engage in public science through scientific blogs and social media. Additionally, the project will provide scientific training opportunities for diverse undergraduate students and a U.S.-based graduate student. 

The research investigates how the distribution of key nutritional resources – food and water – affect how baboons move through their environments. Research suggests that consuming different dietary resources impacts primate gut microbiomes, the microorganisms inhabiting the gut, which, in turn affect primate biology and health. This research uses data drawn from individual baboons residing in natural settings to complement scholarship that is based on environmental and climate proxies rather than direct evidence of nutritional choices. It also adds an explicit focus on water - a critical resource in dry environments and a source of gut bacteria - to understand how diverse dietary choices among individual baboons relate to gut health. The investigators will follow a habituated troop of Kinda baboons to collect behavioral (e.g., diet and movement) and biological (e.g., baboon fecal and water sample) data. Next, they will employ cutting-edge movement ecology analyses (e.g., hidden Markov models) to test different hypotheses related to baboon movement strategies. They will then quantify baboon microbiome diversity and analyze its relationship to water microbiome diversity and pathogen levels (e.g., E. coli and Giardia abundance).

This award reflects NSF's statutory mission and has been deemed worthy of support through evaluation using the Foundation's intellectual merit and broader impacts review criteria.",NSF,University of Massachusetts Amherst,MA,17987,2051465,Jason,Kamilar,1,03/12/2021,Doctoral Dissertation Research: The Effects of Food and Water on Movement and Gut Microbiome Diversity
"This research will salvage and restore a biological research collection critical to understanding the southeastern US flora, make data of this collection widely accessible to researchers, and engage the next-generation of biodiversity scientists. The 20,000 specimen collection, the Lord Fairfax Community College herbarium (LFCC), deeply documents vascular plant species from a historically under-collected US region, the Blue Ridge physiographic province of northwestern Virginia. In 2019, Lord Fairfax Community College donated LFCC to the George Mason University herbarium (GMUF) to safeguard the collection for posterity. LFCC contains numerous high-quality specimens that represent newly discovered county- and state records that expand the Atlas of the Virginia Flora and the Flora of Virginia. Such information is essential for understanding the ecology and evolution of the southeastern US flora and for managing natural resources in one of the nation’s biodiversity hotspots, which is under increasing strain from human modification. This research will ensure that LFCC receives the repair and modern curation it desperately needs in order to be fully utilized as research infrastructure. The combination of LFCC and GMUF will create the third-largest herbarium in Virginia. The co-location of these significant research materials will increase their impact on biodiversity and ecological studies in Virginia and the southeastern US for the foreseeable future. 

The research project will use an efficient workflow to salvage LFCC and its detailed collection notebooks, digitize these data to share with the scientific community and the public at large, and educate students about the importance of natural history collections in scientific research. LFCC specimens will be repaired, annotated, and physically filed with those of GMUF under archival conditions. High-resolution images of LFCC specimens and their label metadata will be disseminated publicly through the SERNEC TCN Symbiota LFCC portal and iDigBio. In order to extend the impact of this research resource, the LFCC collection notebooks will also be digitized and linked to specimen records. Undergraduate students from underrepresented groups and one graduate student will be trained as curatorial assistants over the two-year project period. Project personnel will develop an educational module using LFCC specimens, whose goals are to develop undergraduate students’ awareness of collections’-based research and the extended specimen concept. Multiple outreach events are planned that will engage the broader university community and the public through the Notes from Nature online community science platform using the established Plants of Virginia herbarium label transcription project. A series of public presentations and articles about the results of the project are planned for academic and non-academic audiences.

This award reflects NSF's statutory mission and has been deemed worthy of support through evaluation using the Foundation's intellectual merit and broader impacts review criteria.",NSF,George Mason University,VA,209071,2022918,Andrea,Weeks,1,03/12/2021,"CSBR: Transfer of Ownership: Proposal to salvage, integrate and house the LFCC herbarium at George Mason University."
"Aspects of lifestyle play an important role in shaping how individuals age, but most of what we know about human senescence stems from work with industrialized populations, who do not represent the full range of lifestyles modern humans engage in. This doctoral dissertation project will examine human aging in a non-industrialized population, and evaluate how aspects of lifestyle contribute to age-related patterns of physical and cognitive function. This project will help create a broader picture of how humans experience growing older across a range of biosocial contexts, and so advance our fundamental knowledge about human senescence. The project will inform public health research by examining whether certain aspects of aging can be mitigated through elements of lifestyle. Furthermore, by employing an interdisciplinary approach to the study of aging, this project will strengthen research infrastructure ties among several institutions and departments, and also contribute to the professional development of women in STEM fields. 

In industrialized populations, growing older is associated with declines in physical and cognitive function that limit independence and increase risk of disability. Large-scale epidemiological studies indicate that engaging in high levels of physical activity (PA) may attenuate age-related declines in function. It is not clear, then, whether the age-related functional declines seen in industrialized populations are inevitable aspects of human senescence or by-products of sedentary industrialized lifestyles. This project will examine variation in lifestyle and aging in hunter-gatherer populations that currently include members who continue to engage in full-time foraging, and others who engage in more market-integrated lifestyles with less reliance on foraging. The project tests the overarching hypothesis that variation in engagement in traditional foraging practices is associated with distinctive PA profiles that benefit age-related patterns of physical and cognitive function. Researchers will recruit participants (ages 18+) from communities who engage in different amounts of foraging, and participants will complete tests of physical and cognitive function. Participants will also wear an accelerometer for several days, allowing researchers to characterize patterns of PA. The researchers will compare age-related patterns of function for non-industrialized and industrialized populations, as well as assess whether amount of foraging is related to variation in age-related patterns of function. They will also use formal mediation analyses to assess how patterns of PA influence the relationship between age, function, and amount of foraging.

This award reflects NSF's statutory mission and has been deemed worthy of support through evaluation using the Foundation's intellectual merit and broader impacts review criteria.",NSF,University of Southern California,CA,32819,2051519,David,Raichlen,1,03/08/2021,"Doctoral Dissertation Research: Aging, activity patterns and function in modern foragers"
